[
  {
    "id": "task_mock_runtime:evt:000001",
    "sequence": 1,
    "event": "progress",
    "taskId": "task_mock_runtime",
    "taskType": "video",
    "status": "processing",
    "progress": 24,
    "message": "已完成题目理解",
    "timestamp": "2026-03-30T14:30:00Z",
    "requestId": "req_task_runtime_mock_001",
    "errorCode": null,
    "context": {
      "stage": "outline"
    }
  },
  {
    "id": "task_mock_runtime:evt:000002",
    "sequence": 2,
    "event": "progress",
    "taskId": "task_mock_runtime",
    "taskType": "video",
    "status": "processing",
    "progress": 68,
    "message": "已完成镜头与旁白生成",
    "timestamp": "2026-03-30T14:31:30Z",
    "requestId": "req_task_runtime_mock_001",
    "errorCode": null,
    "context": {
      "stage": "storyboard"
    }
  }
]
