[
  {
    "id": "task_mock_completed:evt:000001",
    "sequence": 1,
    "event": "connected",
    "taskId": "task_mock_completed",
    "taskType": "video",
    "status": "pending",
    "progress": 0,
    "message": "SSE 通道已建立",
    "timestamp": "2026-03-30T13:05:00Z",
    "requestId": "req_task_mock_completed_sse",
    "errorCode": null,
    "stage": "bootstrap"
  },
  {
    "id": "task_mock_completed:evt:000002",
    "sequence": 2,
    "event": "progress",
    "taskId": "task_mock_completed",
    "taskType": "video",
    "status": "processing",
    "progress": 18,
    "message": "任务已进入处理阶段",
    "timestamp": "2026-03-30T13:05:05Z",
    "requestId": "req_task_mock_completed_sse",
    "errorCode": null,
    "stage": "outline"
  },
  {
    "id": "task_mock_completed:evt:000003",
    "sequence": 3,
    "event": "heartbeat",
    "taskId": "task_mock_completed",
    "taskType": "video",
    "status": "processing",
    "progress": 48,
    "message": "任务仍在执行中",
    "timestamp": "2026-03-30T13:05:12Z",
    "requestId": "req_task_mock_completed_sse",
    "errorCode": null,
    "stage": "generation"
  },
  {
    "id": "task_mock_completed:evt:000004",
    "sequence": 4,
    "event": "completed",
    "taskId": "task_mock_completed",
    "taskType": "video",
    "status": "completed",
    "progress": 100,
    "message": "任务执行完成",
    "timestamp": "2026-03-30T13:05:18Z",
    "requestId": "req_task_mock_completed_sse",
    "errorCode": null,
    "stage": "completed",
    "result": {
      "artifactUrl": "https://static.prorise.test/results/task_mock_completed.mp4"
    }
  }
]
