[
  {
    "id": "task_mock_snapshot:evt:000001",
    "sequence": 1,
    "event": "connected",
    "taskId": "task_mock_snapshot",
    "taskType": "video",
    "status": "pending",
    "progress": 0,
    "message": "SSE 通道已建立",
    "timestamp": "2026-03-30T13:05:00Z",
    "requestId": "req_task_mock_snapshot_sse",
    "errorCode": null,
    "stage": "bootstrap"
  },
  {
    "id": "task_mock_snapshot:evt:000002",
    "sequence": 2,
    "event": "progress",
    "taskId": "task_mock_snapshot",
    "taskType": "video",
    "status": "processing",
    "progress": 33,
    "message": "任务处理中状态已同步",
    "timestamp": "2026-03-30T13:05:08Z",
    "requestId": "req_task_mock_snapshot_sse",
    "errorCode": null,
    "stage": "outline"
  },
  {
    "id": "task_mock_snapshot:evt:000003",
    "sequence": 3,
    "event": "snapshot",
    "taskId": "task_mock_snapshot",
    "taskType": "video",
    "status": "processing",
    "progress": 33,
    "message": "已恢复到最近可用快照",
    "timestamp": "2026-03-30T13:05:15Z",
    "requestId": "req_task_mock_snapshot_sse",
    "errorCode": null,
    "stage": "outline",
    "resumeFrom": "task_mock_snapshot:evt:000002"
  }
]
