{
  "id": "task_provider_failover_001:evt:000003",
  "sequence": 3,
  "event": "provider_switch",
  "taskId": "task_provider_failover_001",
  "taskType": "video",
  "status": "processing",
  "progress": 52,
  "message": "主 Provider 不可用，已切换备用 Provider",
  "timestamp": "2026-03-30T20:20:00Z",
  "requestId": "req_provider_failover_001",
  "errorCode": "TASK_PROVIDER_TIMEOUT",
  "from": "demo-chat",
  "to": "backup-chat",
  "reason": "provider timeout",
  "context": {
    "module": "video"
  }
}
