[
  {
    "id": "task_mock_provider_switch:evt:000001",
    "sequence": 1,
    "event": "connected",
    "taskId": "task_mock_provider_switch",
    "taskType": "video",
    "status": "pending",
    "progress": 0,
    "message": "SSE 通道已建立",
    "timestamp": "2026-03-30T13:05:00Z",
    "requestId": "req_task_mock_provider_switch_sse",
    "errorCode": null,
    "stage": "bootstrap"
  },
  {
    "id": "task_mock_provider_switch:evt:000002",
    "sequence": 2,
    "event": "progress",
    "taskId": "task_mock_provider_switch",
    "taskType": "video",
    "status": "processing",
    "progress": 44,
    "message": "任务处理中",
    "timestamp": "2026-03-30T13:05:05Z",
    "requestId": "req_task_mock_provider_switch_sse",
    "errorCode": null,
    "stage": "generation"
  },
  {
    "id": "task_mock_provider_switch:evt:000003",
    "sequence": 3,
    "event": "provider_switch",
    "taskId": "task_mock_provider_switch",
    "taskType": "video",
    "status": "processing",
    "progress": 45,
    "message": "主 Provider 不可用，已切换备用 Provider",
    "timestamp": "2026-03-30T13:05:09Z",
    "requestId": "req_task_mock_provider_switch_sse",
    "errorCode": "TASK_PROVIDER_UNAVAILABLE",
    "stage": "generation",
    "from": "gemini-2_5-flash",
    "to": "claude-3_7-sonnet",
    "reason": "primary provider unavailable"
  }
]
